,Identifier,Title,Subject,Date,Text,locations,tags
1712,14972,"Eleanor Daggett Karsten to Orell Fssli, April 9, 1917","Addams, Jane, books read",1917-04-09,april 9th 1917 art insititut orel fuss zurich viii640 zurich switzerland gentleman request miss jane addam sent saturday april 7th intern money order twelv franc address cover two year subscript intern review enclos bill origin receiv call nine franc year half subscript glad receiv acknowledg money order sincer offic secretari,"41.8802312,-87.6245874",Requests
1717,14954,"Eleanor Daggett Karsten to Catherine Colvin, May 7, 1917","Hull-House, events;peace movement, activities of",1917-05-07,may 7th 1917 dear miss colvin sorri offic came friday spoke miss addam morn suggest mr norton give talk expect give hullhous lake forest also said would take mr norton thought perhap might arrang shall tri let know definit soon suggest work chicago branch met warm recept hope annual meet wednesday expect talk program sincer offic secretari miss catharin colvin lake forest illinoi,"41.8802312,-87.6245874",Lectures;Peace
1718,14950,"Jane Addams to Louis Paul Lochner, May 7, 1917","peace movement, activities of;peace movement, organization of;Addams, Jane, and peace movement;Addams, Jane, memberships in organizations",1917-05-07,may 7th 1917 dear mr lochner plan telegraph cours interest much gener outlin fall plan committe discus unwil name use group unless constant commun plan chang must necessarili come emerg matter like dislik refus anyth ask sure realiz permiss travel attend meet restrict better work nearer hand plea send materi soon print conceiv could form branch although would depend great mani peopl besid nucleu littl group met sever time plan public meet auditorium sunday afternoon may 27th plan develop keep u inform possibl meet similar organ might form glad still new york gone florida good luck faith mr loui p lochner seci emerg peac feder 70 west fifth avenu new york citi,"41.8781136,-87.6297982",Memberships;Peace;Requests
1719,14949,"Eleanor Daggett Karsten to Eleanor Wilson Parker, April 12, 1917","World War I, opposition to;Addams, Jane, requests to;peace movement, activities of",1917-04-12,april 12th 1917 dear miss parker miss addam chicago present return sever day return undoubtedli swamp work away citi sever month would suggest wish articl magazin write mr lucia ame mead 19 euston street coolidg corner boston massachusett mr mead best possibl author question militari servic would glad sure furnish articl hope suggest may reach time assist sincer offic secretari,"41.8802312,-87.6245874",Peace;Requests
1721,14936,"Jane Addams to Myra Harriet Reynolds Linn, June 5, 1917","Addams, Jane, and family;clothing",1917-06-05,dear myra send jane romper made trade school hope famili like littl pink sweater fit tri one essay bigger one marcet haldemanjuliu daughter alic week old see famili grow love trio alway devot aunt j addam june 5 1917 chicago ill,"41.8781136,-87.6297982",Family
1723,14933,"Jane Addams to Lydia Cooper Lewis, June 5, 1917","Hull-House, programs",1917-06-05,hullhous 800 south halst street chicago dear miss lewi hope abl present product trade school best love sincerest admir today sorri leav note sure know goe heart doesnt look much like russia must hot day pacif bless alway devotedli jane addam june 5 1917 page 2 miss lewi hail farewel,"41.8716164,-87.6474573",Hull-House
1725,14913,"Jane Addams to Emily Greene Balch, June 1917","peace movement, activities of;Addams, Jane, requests to",1917-06-01,western union telegram copi miss emili g balch henri street settlement new york citi delay repli hope help passport find noth send letter may use washington think necessari come washington think would better delay cabl jacob passport uncertain entir plan unabl go jane addam,"40.7140074,-73.9845201",Peace;Requests;Travels
1726,14909,"Jane Addams to Salmon Oliver Levinson, May 26, 1917","Hull-House, finances;Addams, Jane, requests from",1917-05-26,hullhous 800 south halst street chicago may 26th 1917 dear mr levinson enclos plea find coaltonnag last seventeen month averag price shall grate give u suggest help next year might enabl u avoid horribl total thank kind faith jane addam sign salmon levinson esq 76 west monro street chicago illinoi,"41.8716164,-87.6474573",Finances;Hull-House
1728,14904,"Eleanor Daggett Karsten to Helen Campbell, May 28, 1917","Addams, Jane, requests from",1917-05-28,may twentyeighth 1917 dear miss campbel enclos letter recent receiv mr smith refer previou letter miss addam sent miss abbott miss addam written mr smith matter refer probabl confus time miss abbott departur matter overlook miss addam also ask thank list sent saturday sincer offic secretari miss grace helen campbel 1140 michigan avenu chicago illinoi enc,"41.8802312,-87.6245874",Thanks
1730,14893,"Eleanor Daggett Karsten to Alice Thacher Post et al., May 26, 1917","peace movement, activities of",1917-05-26,sent mr slayden mr mead mr post miss gale mr spencer mr taussig may twentysixth 1917 dear mr post sever member board friday conveni date board meet sunday miss addam therefor ask say board meet call friday june first tenthirti henri street settlement 265 henri street new york citi miss wald kindli offer hospit settlement date sincer offic secretari mr loui f post hotel buckminst boston massachusett,"41.8802312,-87.6245874",Peace
1733,14885,"Jane Addams to Anna Garlin Spencer, May 24, 1917","peace movement, activities of;Addams, Jane, requests from",1917-05-24,western union telegram may 24th 1917 mr anna garlin spencer 669 alden st meadvil pennsylvania mr post prefer board meet friday june first possibl come either june first june second plea wire state possibl come prefer date jane addam charg woman peac parti 116 south michigan ave,"41.8802312,-87.6245874",Peace;Requests
1736,14866,"Eleanor Daggett Karsten to Katherine Davis Cumberson, May 28, 1917","peace movement, activities of;World War I, home front",1917-05-28,may 28th 1917 dear mr cumberson board meet final call friday june first henri street settlement wish much could meet thirtyf deleg congress war held place june second saturday letter came miss addam left new york show print form letter accompani ask write refer third paragraph refer action execut council offer servic woman peac parti unit red cross work take refer state execut council california action taken nation board cours statement seem quit clear probabl would clear peopl california mr thoma home spent month tennesse return chicago rest strenuou winter sincer offic secretari mr c e cumberson 601 univers ave palo alto california,"41.8802312,-87.6245874",Peace
1738,14846,"Eleanor Daggett Karsten to Anna Norma Porter, May 21, 1917","peace movement, activities of",1917-05-21,may 21st 1917 dear miss porter miss addam ask thank recent letter read much interest think may perhap interest materi recent publish woman peac parti take liberti send separ cover sincer secretari jane addam miss anna porter 75 e st jame st san jo california,"41.8802312,-87.6245874",Peace
1739,14845,"Eleanor Daggett Karsten to Alice Thacher Post, May 21, 1917","peace movement, activities of;peace movement, international",1917-05-21,letter mr mead miss breckinridg mr thoma mr spencer mr taussig mr cumberson may 21st 1917 dear mr post announc sent recent meet deleg congress war held new york june 2nd refer made suggest offer british section intern committe woman perman peac miss addam ask send copi suggest sincer offic secretari mr loui f post 2513 12th st washington dc,"41.8802312,-87.6245874",Peace
1740,14836,"Eleanor Daggett Karsten to Kemmie B. Fidler Slade, May 4, 1917","Addams, Jane, requests to;peace movement, activities of",1917-05-04,may 4th 1917 dear miss slade miss addam ask thank letter may 1st send literatur refer work think interest sincer offic secretari miss kemmi b slade 2924 prospect ave kansa citi missouri,"41.8802312,-87.6245874",Peace;Requests
1741,14831,"Jane Addams to Marion Talbot, January 18, 1917","peace movement, financial support for",1917-01-18,intern committe woman perman peac section unit state america woman peac parti offic 116 south michigan avenu chicago illinoi januari eighteenth 1917 dear miss talbot thank much contribut special fund woman congress war glad know fund grow steadili encourag get cordial respons appeal help sincer jane addam sign miss marion talbot univers chicago chicago illinoi,"41.8802312,-87.6245874",Conferences;Peace
1742,14830,"Jane Addams to Jacob Henry Schiff, January 18, 1917","peace movement, activities of;peace movement, financial support for;peace movement, international;World War I, peace negotiations",1917-01-18,intern committe woman perman peac section unit state america woman peac parti offic 116 south michigan avenu chicago illinoi januari eighteenth 1917 dear mr schiff miss wald promis put note letter therefor encourag write although regret commun must long possibl peac confer war nation draw nearer woman committe perman peac variou belliger well neutral countri prepar woman intern congress held time place offici confer shall frame term peac settlement war woman congress plan may 1915 fifteen hundr woman twelv nation met hagu three day held intern congress interest perman peac u present felt fact woman belliger well neutral countri hold finespirit congress midst war auguri part woman might play restor intern goodwil plan separ congress woman also born mind offici confer end war determin term peac would larg compos diplomat necessarili bound tradit convent long domin intercours nation everi countri men least repres modern social thought least respons chang ideal consid suprem import confer diplomat come togeth end war group conven order urg import certain interest hitherto inarticul intern affair need recogn woman intern interest peac organ jew mani countri similar group also plan hold congress time place offici peac confer war sinc meet congress woman hagu may 1915 committe woman perman peac establish twentyseven countri includ china japan twenti countri definit organ alreadi select twentyf page 2 deleg ten altern congress woman held war countri howev either small european neutral heavi burden war belliger whose resourc exhaust war highli import therefor contribut america largest neutral countri one posit woman definit recogn gener enough cover gener expens woman congress everi deleg congress countri repres pay expens cost meet place print interpret heavi desir least 20000 shall contribut toward expens america amount onehalf alreadi pledg woman ventur ask men shown interest peac weari month help complet sum know mr schiff mani claim constantli felt could help u matter would enorm grate miss wald treasur special fund sure let add congratul good wish myriad alreadi receiv recent birthday affection greet mr schiff faith jane addam sign mr jacob schiff 52 william street new york citi,"41.8802312,-87.6245874",Conferences;Peace
1745,14818,"Jane Addams to Madeleine Zabriskie Doty, January 17, 1917","Addams, Jane, requests from;peace movement, international",1917-01-17,januari 17th 1917 dear miss doti sorri see new york sure board ladi manag care hope much would come time saturday morn understand frulein heymann abl come hitch mr pethick lawrenc think would fine could get woman side speak togeth anyth wont write exact statu sincer miss madelein doti 83 washington place new york citi,"41.8781136,-87.6297982",Meetings;Peace;Requests
1747,14813,"Eleanor Daggett Karsten to Katherine Elizabeth Sihler, May 2, 1917","peace movement, activities of",1917-05-02,may 2nd 1917 dear miss sihler letter may 1st refer offic write tell glad inde join woman peac parti send literatur refer work includ recent publish program work war time issu nation woman peac parti one issu chicago branch woman peac parti also send applic membership organ think may wish join possibl interest other neighborhood movement feel definit make program work easier ralli peopl everyon sympathi u eager someth sincer offic secretari miss k elizabeth sihler 815 broadway fort wayn indiana,"41.8802312,-87.6245874",Peace
1750,14791,"Jane Addams to Anita McCormick Blaine, January 17, 1917","Addams, Jane, requests from;peace movement, financial support for",1917-01-17,intern committe woman perman peac section unit state america woman peac parti offic 116 south michigan avenu chicago illinoi januari 17th 1917 dear mr blain enclos letter send member woman peac parti explain woman congress war clearli abl put small compass quit agre feel better men woman thing togeth intern affair yet woman opportun work men begin congress exactli done municip state nation affair although later recogn enclos list contribut alreadi promis felt could give u one thousand dollar enorm grate alway devotedli jane addam sign,"41.8802312,-87.6245874",Finances;Peace
1752,14775,"Jane Addams to Zona Gale, May 2, 1917","Addams, Jane, requests from",1917-05-02,western union day letter may 2 1917 miss zona gale portag wisconsin letter receiv plea lunch tomorrow mr wilmarth room eighteen hundr two congress hotel half past twelv jane addam charg woman peac parti 116 south michigan avenu,"41.8802312,-87.6245874",Meetings
1755,14725,"Eleanor Daggett Karsten to Josephine Hannah Halsne, May 4, 1917","peace movement, activities of;Addams, Jane, requests to",1917-05-04,may 4th 1917 dear mr halsn letter address miss addam refer take great pleasur send separ cover materi refer work woman peac parti includ see applic blank membership would urg join u sympathi work perhap secur member time great import ralli caus mani member possibl send literatur time time strengthen caus strengthen encourag like belief need encourag give cooper also enclos copi program issu chicago branch give suggest work war time sincer offic secretari mr john halsn 136 john street dekalb illinoi,"41.8802312,-87.6245874",Peace;Requests
1759,14671,"Eleanor Daggett Karsten to Carl A. Ryan, April 25, 1917","peace movement, activities of",1917-04-25,april 25th 1917 dear mr ryan miss addam ask send copi program war time execut board woman peac parti adopt think interest also enclos materi refer militari train school matter stand minnesota question legislatur think go believ matter utmost import sincer offic secretari mr c ryan seci world peac associ northfield minnesota,"41.8802312,-87.6245874",Peace
1761,14665,"Eleanor Daggett Karsten to Mary Derrick Coleman, April 25, 1917","peace movement, activities of",1917-04-25,april 25th 1917 dear mr coleman miss addam ask answer kind letter april 21st send materi refer organ woman peac parti also enclos copi program war time publish execut board woman peac parti send quit pamphlet refer militari train school compulsori militari servic two measur feel combat everi way enclos also applic membership woman peac parti hope feel interest alli u receiv notic pamphlet sent organ group woman connect wish affili woman peac parti would glad inde mean annual membership 500 wherea individu membership 100 answer question way plea let know shall glad inde sincer offic secretari mr coleman manhattan kansa rfd 8,"41.8802312,-87.6245874",Peace
1762,14659,"Eleanor Daggett Karsten to Maurice Browne April 25, 1917","Addams, Jane, requests from;peace movement, activities of",1917-04-25,april 25th 1917 dear mr brown miss addam ask refer enclos letter hope may abl give writer inform desir sincer offic secretari mr mauric brown 410 south michigan avenu chicago,"41.8802312,-87.6245874",Peace;Requests
1763,14654,"Eleanor Daggett Karsten to Jewel Cutler, January 10, 1917","peace movement, activities of",1917-01-10,januari tenth 1917 dear miss cutler letter januari 7th address miss addam refer take great pleasur send separ cover bibliographi refer question world peac internation think perhap list distribut includ may use purpos enclos materi includ sever suggest program school celebr possibl may use minneapoli public librari publish sever brief bibliographi along line distribut reader perhap might interest care addit copi materi send glad inde send sincer offic secretari miss jewel cutler 1539 walker de moin iowa,"41.8802312,-87.6245874",Peace;Requests
1764,14649,"Jane Addams to William Isaac Hull, April 24, 1917","Addams, Jane, requests from;peace movement, activities of",1917-04-24,western union day letter april 24th 1917 prof wm hull swarthmor colleg swarthmor pennsylvania written altern plan submit presid februari meet kindli send wish special purpos within next day cordial greet mr hull jane addam charg woman peac parti 116 michigan ave,"41.8802312,-87.6245874",Peace;Requests
1765,14642,"Jane Addams to Dorothy North, April 23, 1917","Addams, Jane, gratitude",1917-04-23,thank much enclos illumin talk mr irv must tell j,"41.8781136,-87.6297982",Thanks
1767,14626,"Jane Addams to Harriet Park Thomas, January 9, 1917","peace movement, activities of",1917-01-09,western union telegram januari 9th 1916 1917 mr william thoma 648 munsey build washington dc would meet twelfth possibl mr mead fourteenth plea repli philadelphia sixti three twenti overbrook avenu overbrook jane addam charg woman peac parti 1506 lakeview build,"39.987519,-75.2507432",Meetings;Peace;Requests
1768,14623,"Jane Addams to Stanley Ross Linn, January 9, 1917","Addams, Jane, and family;Addams, Jane, financial dealings",1917-01-09,hullhous 800 south halst street chicago dear stanley much touch new year present shall take philadelphia whither go pm hope babi better goe well happi famili miss reynold say room ford barn case cours may page 2 better wait build garag although cours want garag soon possibl mani thank much love myra devotedli jane addam jani 9 1917 p think bank interest show thrifti good quit fill pride,"41.8716354,-87.6474381",Family
1769,14598,"Jane Addams to Paul Underwood Kellog, January 7, 1917","Addams, Jane, travels",1917-01-07,hullhous 800 south halst street chicago januari 7 1917 dear mr kellogg expect arriv philadelphia 10th go new york uncertain sure would better plan good wish new year sincer jane addam co miss clara young 6320 overbrook ave overbrook penn paul u kellogg esq new york ny,"41.8716354,-87.6474381",Travels
1771,14577,"Jane Addams to Harriet Park Thomas, November 25, 1915","Addams, Jane, requests from;press, the",1915-11-25,hotel mcalpin greeley squar new york citi dear mr thoma good thing paper sent separ cover dont think want reprint repli kindli seci hastili jane addam nov 25 1915,"40.7498766,-73.9879872",Requests
1774,14529,"Eleanor Daggett Karsten to Eva Marie Campbell, April 19, 1917","peace movement, activities of;Addams, Jane, requests to",1917-04-19,april 19th 1917 dear miss campbel miss addam ask answer letter april 15th gener offer servic peac work open chicago small staff nation offic complet limit fund dispos permit enlarg way howev excel opportun believ work volunt suggest carri teach iowa citi miss klingenhagen dean woman univers iowa believ much interest peac work sure cooper would help would caus also send separ cover materi refer work believ interest wish much effort group colleg woman univers might organ branch woman peac parti branch recent form univers michigan number colleg repres organ sincer offic secretari miss eva campbel 628 north linn street iowa citi iowa,"41.8802312,-87.6245874",Peace;Requests
1776,14474,"Jane Addams to Lola Maverick Lloyd, April 17, 1917","Addams, Jane, gratitude",1917-04-17,dear mr lloyd thank miss holbrook much posi found hullhous one appreci kind much day hope see soon devotedli jane addam april 17 1917,"41.8781136,-87.6297982",Thanks
1777,14473,"Secretary to Jane Addams to Rutherford Thompson Johnstone, November 23, 1915","Addams, Jane, requests to;peace movement, activities of",1915-11-23,novemb 23 1915 dear mr johnston letter novemb 16th complianc request send separ cover copi hagu congress report offic copi report last hagu tribun would refer american peac societi colorado build washington dc way serv time plea let u know sincer assist secretari mr r johnston beaver fall pennsylvania,"41.8781136,-87.6297982",Peace;Requests
1781,14443,"Secretary to Jane Addams to Minnie Edith Bemis Hayes, November 22, 1915","peace movement, activities of",1915-11-22,novemb 22nd 1915 dear mr hay letter address miss jane addam came morn send separ cover number pamphlet woman peac parti think help prepar program peac day way offic servic plea let u know sincer assist secretari mr minni hay conway new hampshir,"41.8781136,-87.6297982",Peace;Requests
1783,14244,"Mabel L. Hyers to Daisy Touzon Kay, November 17, 1915","peace movement, activities of",1915-11-17,novemb 17th 1915 dear mr kay good know club contempl meet peac pleasur send separ cover literatur think help newspap clip part valu whatev either fact paint effici report activ might say pas woman peac parti one hundr fifti group four hundr fifti nation member asid join group sincer assist secretari mr daisi kay morocco indiana,"41.8781136,-87.6297982",Peace
1792,14118,"Eleanor Daggett Karsten to Mary Seiple Dellinger, March 22, 1917","peace movement, women and",1917-03-22,march 22nd 1917 dear mr delling miss addam away citi letter refer offic take great pleasur send separ cover materi refer effect woman work prevent war afraid exactli want may use also send materi may interest refer work sincer offic secretari mr mari delling bloomvil ohio,"41.8802312,-87.6245874",Peace
1799,14020,"Eleanor Daggett Karsten to Donald Angus McQueen, March 17, 1917","peace movement, activities of",1917-03-17,march 17th 1917 dear mr mcqueen ill away offic time return find letter address miss addam includ suggest memori presid desk miss addam town time away april write mere thank let know receiv offic think memori excel one understand speak 25th march mass meet harvey execut secretari mr william thoma also speak hope take opportun talk refer question militari train school washington last two month devot attent especi question also particularli interest hear held differ citi illinoi refer bill state legislatur call militari train school boy age sixteen nineteen sure abl give mr thoma valuabl suggest refer best method attack sincer offic secretari mr mcqueen 2034 west 111th st chicago illinoi,"41.8802312,-87.6245874",Peace
1803,13994,"Florence Wells Young to Rosika Schwimmer, August 31, 1914","Addams, Jane, travels",1914-08-31,hullhous 800 south halst street chicago august 31 1914 dear miss schwimmer miss addam expect return chicago middl septemb come directli hullhous present howev east may address hull cove main commun sent hullhous gladli preserv request miss addam return bring promptli possibl attent sincer florenc w young sign seci miss rosika schwimmer new york,"41.8716354,-87.6474381",Travels
1805,13986,"Eleanor Daggett Karsten to Harriet Taylor Upton, March 24, 1917","Addams, Jane, health of;peace movement, activities of",1917-03-24,march twentyfourth 1917 dear mr upton miss addam appreci much letter explain attitud miss dupont connect action execut council nation woman suffrag associ miss addam florida recuper rapidli happi say especi want copi resolut pas recent confer woman peac parti new york citi sincer mr harriet taylor upton mason build warren ohio enc,"41.8802312,-87.6245874",Health;Peace
1806,13985,"Eleanor Daggett Karsten to Gladys Emelora Sinclair, March 24, 1917","peace movement, activities of;World War I, opposition to;World War I, United States entry",1917-03-24,march twentyfourth 1917 dear mr sinclair letter march 11th address miss addam refer offic miss addam absenc citi write say suggest call nation convent woman bring pressur war one would requir great deal time money work effect wish convent might call seem practic time howev someth told washington effect done send mani messag possibl either wire letter postal presid congressman state urg declar war time also express strong opposit compulsori militari servic strong probabl measur consid come session congress pas influenc war scare tremend pressur brought bear accomplish urg everyon therefor send messag suggest urg other believ effect thing time sincer offic secretari mr john f sinclair 312 north raymond st pasadena california,"41.8802312,-87.6245874",Peace;World War I
1808,13961,"Jane Addams to Harriet P. Thomas, March 16, 1917","Addams, Jane, health of;Addams, Jane, memberships in organizations;peace movement, activities of",1917-03-16,march 16 1917 dear ladi glad back sure find well chicago offic mr karsten return wonder weather improv fast cherish hope normal human upon return curiou hear page 2 washington situat never becam member emerg feder ny washington although suspect public never knew certainli dont want go back startl clip isnt present develop strang hope wont feel must return april 16 event see send materi file alway devotedli jane addam,"28.555001,-81.6331299",Health;Peace
1810,13945,"Jane Addams to Eleanor Daggett Karsten, March 24, 1917","peace movement, activities of;peace movement, organization of",1917-03-24,hotel windsor jacksonvil fla dear mr karsten leav florida today next stop summervil south carolina address pine forest inn summervil car plan washington april 10 th arriv monday even 9 th leav 11 th written mr post suggest confer mani member board wpp conveni come page 2 usa situat chang rapidli sinc last meet think confer would great comfort u could washington confer 7 th saturday would better other although easter sunday apt find peopl plan plea call meet confer meet 10 th hotel raleigh washington make clear board member expect make extraordinari effort come page 3 ask telegraph much prefer 7 th hear 10 th stand want overdo meet crisi like fact woman organ util may littl offset type organ plea show letter mr thoma write certainli chicago hope washington tenth plea dont overdo believ devotedli jane addam march 24 1917,"30.328937,-81.659251",Peace
