,Identifier,Title,Subject,Date,Text,locations,tags
2549,8032,"Secretary to Jane Addams to Maggie Murray Washington, March 4, 1915","Addams, Jane, requests to;peace movement",1915-03-04,march fourth 1915 mr booker washington tuskege institut tuskege alabama dear mr washington miss addam request sent address yesterday one hundr peac pin woman club miss addam wish member club one pin cordial assist secretari,"41.8781136,-87.6297982",Peace;Requests
2550,8030,"Secretary to Jane Addams to Ada M. Morley, March 4, 1915","peace movement, activities of;Addams, Jane, requests to",1915-03-04,march fourth 1915 mr ada morley datil new mexico dear mr morley cordial letter miss addam receiv week ago answer great pressur work offic particularli connect emerg peac meet held chicago last week miss addam wish thank letter offer help mean great deal offer help send literatur tell peac parti start hope wctu organ help movement send letter mani reach ask help person work could form local group would take membership nation associ group six peopl may join associ pay 500 treasuri group may fix local due fee individu member whatev work wish undertak form group glad receiv individu membership 100 question answer leaflet sent plea hesit write offic tri repli promptli last letter sincer assist secretari,"41.8781136,-87.6297982",Memberships;Peace;Requests
2551,8028,"Secretary to Jane Addams to Edward Lea Marsh, March 4, 1915","Addams, Jane, requests to;peace movement, activities of",1915-03-04,march fourth 1915 mr edward lea marsh sanduski ohio dear mr marsh miss addam ask repli letter februari 17th thank suggest contain letter turn committe art possibl use made suggest may say read articl mr baker american magazin seem quit right idea move pictur film might made enclos statement regard woman peac parti may interest truli assist secretari,"41.8781136,-87.6297982",Peace;Requests
2553,8023,"Secretary to Jane Addams to Jean Swinton Hutchins, March 4, 1915","Addams, Jane, requests to;peace movement, activities of",1915-03-04,march fourth 1915 mr jean swinton hutchin 537 belmont avenu chicago dear mr hutchin press busi offic letter februari 14th contain suggest regard lay arm remain unansw glad know alreadi letter came arrang made photo film lay arm present banquet emerg peac feder last saturday night program arrang suggest receiv write mr van alstyn regard place name upon list reader send respons request speaker reader miss addam wish express thank interest suggest sincer assist secretari,"41.8781136,-87.6297982",Peace;Requests
2555,8017,"Secretary to Jane Addams to Sophonisba P. Breckinridge, March 4, 1915","peace movement, activities of;Addams, Jane, requests from",1915-03-04,march 4 1915 dear miss breckinridg miss addam request ask whether suit better execut council meet new york friday march 12th washington sunday march 14th plea repli hotel belmont 42 st new york citi enclos minut last execut council meet announc product trojan woman feel happi sincer miss sophonisba p breckinridg 116 south michigan avenu chicago illinoi,"41.8781136,-87.6297982",Peace;Requests
2557,8009,"Lucia Osbourne Ford Rutter to Margaret Dreier Robins, November 29, 1912.","Addams, Jane, requests to",1912-11-29,dear mr robin may man statist literatur want l ford sec miss addam refus invit,"41.8781136,-87.6297982",Requests
2559,7994,"Secretary to Jane Addams to Carrie Chapman Catt, March 2, 1915","peace movement, activities of;Addams, Jane, requests from",1915-03-02,march 2 1915 dear mr catt miss addam ask send enclos copi cablegram late receiv send member cooper council woman peac parti hope larg deleg possibl may go take part counsel congress ask tell much wish might go woman particularli desir present miss addam cabl accept invit woman peac parti say end april would best time congress may express miss addam urgent hope may abl go truli assist secretari mr carri chapman catt 2 west 86th st new york,"41.8781136,-87.6297982",Peace;Requests
2561,7991,"Jane Addams to Raymond Robins, March 2, 1915","Addams, Jane, and Progressive Party;Addams, Jane, memberships in organizations",1915-03-02,hullhous 800 south halst street chicago march 2 1915 dear mr robin written mr ingersol longer member progress execut committe sent materi also probabl hear directli apolog troubl hastili jane addam sign raymond robin esq chicago illinoi,"41.8716782,-87.6474517",Memberships
2562,7986,"Jane Addams to Anna Marcet Haldeman, March 1915","Addams, Jane, and family;health, illness, and disease",1915-03-01,12 west walton place dear marcet mother suffer good deal examin yesterday seem much better today quit cheer doctor insist new growth great deal inflamm hope allay page 2 vigor treatment hospit spite douch steadili sinc chicago last inflamm increas insist must stay hospit cure write time time situat develop mother nurs blue met train evid hard fortnight much much reconcil life today get hurri note late speech mari smith send love love aunt j,"41.9001376,-87.6290303",Family;Health
2564,7971,"Jane Addams to Frederick Paul Keppel, February 26, 1915","Addams, Jane, gratitude;peace movement, activities of",1915-02-26,feb 26 1915 dear mr keppel written mr haskel express gratitud gener arrang made execut committe consent cours arrang state letter may also assur appreci appoint mr thoma organ today st paul minneapoli report splendid meet south may express appreci abl present caus member committe assur intent everyth possibl make gener appropri count caus faith,"41.8716354,-87.6474381",Peace;Thanks
2566,7969,"Jane Addams to Le Baron Russell Briggs, February 26, 1915","Addams, Jane, lectures;Addams, Jane, and peace movement;Addams, Jane, views on social work",1915-02-26,hullhous 800 south halst street chicago februari 26 1915 dear dr brigg thank much kind letter take topic war versu social servic much appreci courtesi apolog delay repli faith jane addam sign dr l b brigg cambridg massachusett,"41.8716782,-87.6474517",Lectures
2567,7968,"Jane Addams to Robert Underwood Johnson, November 12, 1912","Addams, Jane, requests from;Addams, Jane, writing",1912-11-12,hullhous 800 south halst street chicago nov 12 1912 dear mr johnson sinc return occupi accumul matter imposs write articl time januari magazin perhap permit make littl gener charact send later send letter hastili may save room articl sincer jane addam sign robert underwood johnson esq new york citi,"41.8716354,-87.6474381",Requests;Writing
2572,7917,"Secretary to Jane Addams to Nina E. Allender, February 23, 1915","peace movement, activities of",1915-02-23,februari 23 1915 dear mr allend miss addam ask repli letter ask list state chairman enclos list far chairman appoint send addit name fast receiv accept thank copi resolut sent truli assist secretari mr nina e allend 1315 clifton st washington dc,"41.8781136,-87.6297982",Memberships;Requests
2575,7898,"Secretary to Jane Addams to Katherine Leckie, January 26, 1915","Addams, Jane, requests from;Addams, Jane, memberships in organizations",1915-01-26,januari 26 1915 miss katherin lecki 17 e 38th st new york ny dear miss lecki miss addam understood mr villard go see regard chairmanship press committe organ work woman peac parti ask express earnest hope abl accept request telegraph soon decis made noth develop connect work encourag miss addam much idea effici press committe headquart new york hope hear accept sincer,"41.8781136,-87.6297982",Memberships;Requests
2577,7890,"Jane Addams to Sarah Alice Addams Haldeman, December 19, 1913.","holidays and celebrations;Addams, Jane, and family",1913-12-19,hullhous 800 south halst street chicago dear alic send christma packag today avoid final rush know fond work metal old holi water receptacl got pari last summer cours use match anyth like sent dearest marcet present cedarvil decid go page 2 plea keep unopen christma morn best love merri christma alway love sister jane addam dec 19 1913,"41.8716782,-87.6474517",Family;Holidays
2578,7889,"Jane Addams to Lillian D. Wald, December 11, 1913","Addams, Jane, travels",1913-12-11,hullhous 800 south halst street chicago dear ladi russian friend leav ny tomorrow next day may send either hold make arrang letter miss lewisohn mde kropotkin send mde k 800 hope send hard get money natur case sure like littl ladi page 2 isnt bad mde breshkovski isnt whole thing heartbreak alway forev yr j dec 11 1913 p miss scholnik month made mani friend,"41.8716782,-87.6474517",Travels
2579,7864,"Harriet Park Thomas to Alice Thacher Post, January 25, 1915","peace movement, women and;Addams, Jane, requests from;Addams, Jane, memberships in organizations",1915-01-25,woman peac parti nation offic room 500 116 michigan ave chicago januari 25 1915 mr loui post 2513 12th st washington dc dear mr post miss addam sent back postal leav new york friday ask answer letter 19th length anxiou inform present report washington meet elect charter member woman peac parti list incomplet give mani instanc name without initi surnam occasion without even place resid connect mr fitzgerald right ground see suppli u complet list sincer harriet p thoma sign,"41.8803032,-87.6249745",Memberships;Peace;Requests
2580,7854,"Secretary to Jane Addams to Charlotte Perkins Gilman to February 19, 1915","peace movement, activities of;peace movement, organization of",1915-02-19,februari 19 1915 dear mr gilman miss addam ask write tell suggest regard design badg flag etc woman peac parti submit art committe miss florenc holbrook chairman also matter adopt flag would pas execut council probabl know pin use chicago deleg washington adopt offici badg woman peac parti sold fifteen cent apiec secur hyman compani 31 north state street chicago sincer mr charlott perkin gilman 67 wall street new york ny,"41.8716354,-87.6474381",Peace
2589,7792,"Secretary to Jane Addams to Katherine L. Barnhart Paddock, January 29, 1915","Addams, Jane, memberships in organizations;peace movement, women and",1915-01-29,januari 29 1915 mr katherin l paddock 223 east main st malon n dear mr paddock letter miss addam refer answer happi inform nation headquart woman peac parti establish enclos literatur platform plan work list offic final shape soon readi distribut forward membership blank acknowledg check forward treasur sincer,"41.8781136,-87.6297982",Peace
2590,7788,"Jane Addams to Nina E. Allender, January 21, 1915","Addams, Jane, memberships in organizations;peace movement, organization of;women, political culture",1915-01-21,hullhous 800 south halst street chicago januari 21 1915 dear mr allend think vicepresid appoint list sent confirm everi case save massachusett alreadi appoint mr malcolm forb milton massachusett look list care seem possibl make appoint suggest sorri massachusett perhap explain mr robert mr forb meet activ etc regard nation plan organ hope state cours district columbia would free possibl local matter mr mead instanc boston suggest new england offic alli state think someth sort would possibl washington neighbor state disctrict inclin liber name use circl branch anyth el seem go simpli put underneath name word affili woman peac parti would object ad page 2 name peopl legisl committe peopl live differ part countri special affili congress name sent seem good grate everi bit organ alreadi made telegraph mr ruble send u platform print one two minor correct made platform committe send copi soon finish hastili mr nina e allend washington dc,"41.8716782,-87.6474517",Memberships;Peace
2591,7785,"Secretary to Jane Addams to Anna B. Foos, January 29, 1915","peace movement, women and;Addams, Jane, memberships in organizations",1915-01-29,januari 29 1915 miss anna b foo 1706 east high st springfield ohio dear miss foo letter miss addam refer answer happi inform nation headquart woman peac parti establish enclos literatur platform plan work list offic final shape soon readi distribut forward sincer,"41.8781136,-87.6297982",Peace
2592,7782,"Secretary to Jane Addams to Rose D. Rittman, February 18, 1915","peace movement, activities of;Addams, Jane, requests from",1915-02-18,fbi 18 1915 dear mr rittman miss addam ask inform execut council woman peac parti select member cooper council organ see compos presid nation woman societi enclos two pamphlet explain plan purpos woman peac parti earnestli hope abl serv member cooper council sincer mr rose rittman high chief ranger cathol woman order forest 4543 indiana avenu chicago illinoi,"41.8781136,-87.6297982",Memberships;Peace
2595,7776,"Jane Addams to Alice Henry, February 18, 1915","Addams, Jane, requests from;meetings",1915-02-18,hullhous 800 south halst street chicago februari 18 1915 dear miss henri send proposit mr kellogg came last night perhap see mr robin go south saturday morn hastili jane addam sign miss alic henri chicago illinoi,"41.8716782,-87.6474517",Meetings;Requests
2596,7768,"Jane Addams to Theodore Roosevelt, January 20, 1915","Addams, Jane, relationship with Theodore Roosevelt;Addams, Jane, requests to",1915-01-20,hullhous 800 south halst street chicago januari 20 1915 dear col roosevelt took day find wj mccoy differ street number seventi year old live four year 3850 wabash avenu old scotch coupl appar kind abl pay rent make littl money address envelop rather secret landlord say never heard mention member regiment bare possibl found right man twice envoy tri find seem like would two mccoy within door investig littl let know discov anyth like give case chariti investig possibl kindli young man dull page 2 although energet abl sure need tell alway pleasur servic even slight matter faith jane addam sign hon theodor roosevelt oyster bay new york,"41.8716782,-87.6474517",Requests
2597,7727,"Statement appointing Ickes to serve as Jane Addams' proxy, August 3, 1914",meetings;Progressive Party,1914-08-03,hullhous 800 south halst street chicago hull cove main aug 3 1914 herebi appoint harold ick serv proxi meet execut committe nat com progress parti held new york 8 th august 1914 jane addam,"44.4192455,-68.2505706",Meetings
2599,7723,"Jane Addams to Sarah Alice Addams Haldeman, July 30, 1914","Addams, Jane, and family;health, illness, and disease",1914-07-30,hullhous 800 south halst street chicago hull cove main juli 30 1914 dear alic letter yet today although still anoth chanc next post would much better would address letter hull cove main telegram bar harbor care mr bowen hous full rel mani messag come go telegraph messag sometim later get u sent u directli mr bowen continu improv although slowli alway love sister jane addam,"44.4192455,-68.2505706",Family;Health
2602,7669,"Jane Addams to Paul Underwood Kellogg, February 15, 1915","peace movement, activities of;Addams, Jane, and peace movement",1915-02-15,hullhous 800 south halst street chicago februari 15 1915 dear mr kellogg cours eager sign get quickli possibl think doubt want reprint confer 27th 28th way seem come along well hastili jane addam sign p think defens fine one paul u kellogg esq new york ny,"41.8716782,-87.6474517",Conferences;Peace
2604,7661,"Secretary to Jane Addams to Susanna Cocroft, February 13, 1915","peace movement, activities of;Addams, Jane, requests from",1915-02-13,februari 13 1915 dear miss cocroft thank letter mr strother mail literatur hope explain everyth suffici miss addam ask request send write offic plan mention first meet reach larg number woman constant commun like much kind thing thank interest help sincer miss susanna cocroft 624 michigan avenu chicago illinoi,"41.8802312,-87.6245874",Peace;Requests
2605,7648,"Harriet Park Thomas to Anna Sturges Duryea, February 12, 1915","Addams, Jane, requests from;peace movement, women and",1915-02-12,februari 12 1915 mr anna sturg duryea 41 west 34th street new york citi dear mr duryea miss addam ask answer letter februari 10th disappoint definit announc speak middl west get circular announc lectur speaker secur offic miss addam ask may announc avail sort work east cours would greatli prefer put name gener list speak wherev demand present work woman peac parti plea let u hear soon possibl date territori sincer,"41.8716354,-87.6474381",Peace;Requests
2612,7602,"Jane Addams to Margaret A. Haley, December 30, 1914","peace movement, organization of;Addams, Jane, requests from",1914-12-30,hullhous 800 south halst street chicago decemb 30 1914 dear miss haley letter miss harden morn say forward call washington meet miss degraff presid leagu teacher associ live oregon rather unlik anyon would come distanc go repres chicago feder peac societi sincer jane addam sign miss margaret haley chicago illinoi,"41.8716782,-87.6474517",Peace;Requests
2614,7580,"Jane Addams to Lillian D. Wald, July 3, 1914","Addams, Jane, relationship with Lillian Wald;Addams, Jane, personal life",1914-07-03,baymeath bar harbor main dear ladi want write twenti year report seem stun perhap record splendid piec work thorough vari read everi word greatest illeg beauti ever page 2 littl cold mari gone boston day move littl hous next monday delight notion hall clock seem feel none reluct hadnt seen clock grab hope come earli l dek b send cordial greet page 3 alway devotedli jane addam juli 3 1914,"44.3876119,-68.2039123",Friends
2617,7542,"Jane Addams to Harold LeClair Ickes, June 23, 1914","Addams, Jane, requests to",1914-06-23,hullhous 800 south halst street chicago june 23 1914 dear mr ick probabl receiv exact copi enclos correspond send anyway hastili jane addam sign harold l ick esq chicago illinoi,"41.8716354,-87.6474381",Requests
2618,7534,"Jane Addams to Alice Thacher Post, January 15, 1915","Addams, Jane, requests from;peace",1915-01-15,dear mr post letter good thank prompt may list charter member yet receiv affair go well think send sampl new stationeri hastili yr j addam,"41.8781136,-87.6297982",Peace;Requests
2619,7530,"Jane Addams to Sara Louisa McCormack Algeo, June 22, 1914","Addams, Jane, requests to;Addams, Jane, lectures",1914-06-22,hullhous 800 south halst street chicago june 22 1914 dear mr algeo thank much cordial invit imposs accept oblig greatli reduc number speak engag take possibl sincer regret servic good wish faith jane addam sign mr algeo provid ri,"41.8716354,-87.6474381",Lectures;Requests
2620,7518,"Jane Addams to Women's Constructive Peace Conference invitees, December 28, 1914","Addams, Jane, requests from;Addams, Jane, and peace movement;peace movement, women and;peace movement, organization of",1914-12-28,hullhous 800 south halst street chicago dec 28 1914 dear mr andrew invit mr catt unit call togeth number woman organ meet washington januari 10th consid organ nation peac committe woman number committe alreadi organ american citi result lectur given madam schwimmer mr pethick lawrenc washington group arrang meet held januari 10th hope repres citi attend call gather preliminari meet look toward organ woman throughout countri peac movement seem best issu gener call write inform letter name mr carri chapman catt variou nation organ woman stand peac committe variou peac societi expect much help mr lucia ame mead mr anna garland spencer well woman long identifi peac movement enclos copi resolut adopt chicago emerg peac committe might easili use basi discus better keep distinctli woman movement could discus madam schwimmer resolut mr pethick lawrenc term peac third simpl proposit also enclos page 2 difficult cours get togeth hastili larg bodi woman countri take courag howev fact demand spontan univers may ask come send repres peac committe one send accept mr john jay white 2306 massachusett ave washington dc studio hous sheridian circl inform headquart etc hope see washington sincer,"41.8716782,-87.6474517",Conferences;Peace;Requests
2621,7517,"Jane Addams to Carrie Chapman Catt, December 21, 1914","peace movement, organization of;peace movement, women and;gender roles;Addams, Jane, and peace movement",1914-12-21,c p chicago decemb 21 1914 dear mr catt delay repli letter decemb 16th hope situat would clear meantim letter telegram one longdist telephon mr white washington latter promis attend meet januari 10th could get togeth number repres woman meet perhap look toward organ woman throughout countri peac movement approv plan gradual work mind plea telegraph immedi upon receipt letter emerg peac committe organ chicago week ago lectur given madam schwimmer mr pethicklawr grown lusti organ compos men woman men see point call togeth woman meet quit agre masculin manag exist peac societi identifi year believ men woman work best togeth public measur doubt crisi woman eager action agre seem better issu gener call write letter name mine emerg committe group organ stir result lectur given mr pethick lawrenc madam schwimmer clamor action boston new york philadelphia cleveland nashvil st paul ask unit meet washington group arrang januari 10th addit write inform use name well nation organ woman stand peac committe nation feder woman club nation council woman woman depart world peac foundat 40 mt vernon street boston nation socialist woman committe nation intercollegi alumna associ nation woman christian temper union nation suffrag associ nation woman trade union leagu nation leagu teacher organ young woman christian associ daughter american revolut ask includ mother congress nation page 2 feder settlement nation associ chariti correct must cours includ american peac societi associ intern concili arbitr world peac foundat carnegi foundat intern peac church peac union ask send woman repres certainli would wish includ gather peac parad committe new york mr villard miss wald activ write mr lucia ame mead mr anna garland spencer activ year organ peac movement one natur appeal matter doubtless use formul plan enclos copi resolut adopt meet saturday might easili use basi discus better keep distinctli woman movement would discus madam schwimmer resolut mr pethick lawrenc term peac third simpler proposit also send undertak certain sink heart know easi get larg bodi woman togeth difficult take wise action among mani peopl know well demand howev tremend spontan widespread give u confid sincer,"41.8781136,-87.6297982",Conferences;Peace;Requests
2622,7515,"Jane Addams to James Brown Scott, December 28, 1914","peace movement, women and;peace movement, organization of;Addams, Jane, requests from",1914-12-28,hullhous 800 south halst street chicago dec 28 1914 dear mr brown enclos copi letter wrote mr catt perhap explain genesi washington meet better anyth may abl add meet held januari 10th ball room new willard hotel shall hope much cooper would possibl send two woman deleg repres carnegi endow intern peac done commun mr john jay white studio hous sheridan circl washington dc thank possibl cooper sincer jane addam sign,"41.8716782,-87.6474517",Peace;Requests
2624,7461,"Mabel L. Hyers to Walter Lowrie Fisher, January 6, 1915","Addams, Jane, requests to;peace;Chicago, activism in",1915-01-06,januari sixth 1915 dear mr fisher miss jane addam ask write concern vacanc secretaryship chicago peac societi say heartili recommend dr john mez posit person acquaint dr mez past year think well find abl though german strictli neutral attitud toward war sincer assist secretari mr walter l fisher 134 lasal st chicago illinoi,"41.8781136,-87.6297982",Peace;Requests
2630,7423,"Florence Wells to Benjamin Barr Lindsey, December 11, 1913","Addams, Jane, requests to;meetings",1913-12-11,hullhous 800 south halst street chicago decemb 11 1913 hon b b lindsey denver colorado dear sir miss addam return east ask say repli letter came absenc hope present meet drama leagu decemb fifteenth hope reach denver leav chicago sincer florenc well sign seci,"41.8716782,-87.6474517",Meetings;Requests
2631,7422,"Florence Wells to Louise Ayres Garnett, December 11, 1913","Addams, Jane, lectures;Addams, Jane, requests to",1913-12-11,hullhous 800 south halst street chicago decemb 11 1913 dear mr garnett miss addam speak twothirti afternoon decemb fifteenth drama leagu feel regard even thank await miss addam return repli regret affirm one sincer florenc well sign seci mr eugen garnett evanston illinoi,"41.8716782,-87.6474517",Lectures;Requests
2632,7413,"Jane Addams to Rose Dabney Forbes, January 2, 1915","peace;Addams, Jane, requests from;conferences",1915-01-02,hullhous 800 south halst street chicago jan 2 1915 dear mr forb suggest mr mead send invit peac meet washington januari 10th enclos letter wrote day ago mr catt perhap best explan situat need tell much hope come much presenc add valu meet sincer jane addam sign,"41.8716782,-87.6474517",Meetings;Peace;Requests
2634,7408,"Jane Addams to Raymond Robins, December 28, 1914","Addams, Jane, and Progressive Party;Addams, Jane, memberships in organizations",1914-12-28,hullhous 800 south halst street chicago decemb 28 1914 dear mr robin enclos letter miss kellor explain meet chicago postpon consider progress servic januari meet execut committe parti tri resign mr perkin urg wait meet said made state chairman illinoi resign came would put execut board quit thing justifi remain committe long plea use enclos proxi meet also hand resign also enclos instead send directli mr perkin hope much entir programm go outlin page 2 wrote mr robin day ago regard peac meet arrang held washington januari 10th hope much inde possibl attend good wish new year alway faith jane addam sign raymond robin esq chicago illinoi,"41.8716782,-87.6474517",Memberships;Requests
