,Identifier,Title,Subject,Date,Text,locations,tags
2130,11915,"Jane Addams to Eleanor Daggett Karsten, May 12, 1916","peace movement, activities of;Addams, Jane, requests from",1916-05-12,hullhous 800 south halst street chicago may 12 1916 dear mr karsten enclos plea find telegram rather copi telegram mr holt sent morn think sent letter citi mention text written mr post directli washington regard meet faith jane addam sign p return mr devil play apolog delay arent thing submit art literatur committe suppos mr schtze would repli directli author,"41.8716164,-87.6474573",Peace;Requests
2132,11908,"Jane Addams to Anna Marcet Haldeman, February 21, 1916","Addams, Jane, and family;travels;Addams, Jane, health of;Addams, Jane, travels",1916-02-21,antler colorado spring dear marcet sent typewritten copi hear washington mistak manuscript sent mr karsten woman peac parti 116 michigan ave chicago seem mix letter day quit enchant photograph clientel real thing make quit homesick neighbor mari send love california even page 2 midst pack good visit cant keep hope find new orlean possibl alway devotedli j addam febi 21st 1916 p slight relaps quit alright,"38.8337863,-104.8256397",Family;Health;Travels
2135,11887,"Jane Addams to Ellery Sedgwick, March 8, 1916","Addams, Jane, requests to;Addams, Jane, writings",1916-03-08,mission inn riversid california dear mr sedgwick quit will abid decis regard cut ms devilbabi hullhous herewith return sincer jane addam sign march 8 proof would cours sent hullhous return within week,"33.9533487,-117.3961564",Requests
2138,11881,"Eleanor Daggett Karsten to Lily M. Sharp, March 4, 1916","Addams, Jane, requests to;peace movement, activities of",1916-03-04,march 4th 1916 dear miss sharp take great pleasur send separ cover materi refer woman peac parti hope use sale offic offici report intern congress woman hagu contain pictur variou deleg congress among good pictur miss addam sell sixti cent perhap would like send copi sincer offic secretari miss lili sharp calvert hotel dayton ohio,"41.8802312,-87.6245874",Peace;Requests
2139,11879,"Jane Addams to Mary Fry, May 12, 1916","Addams, Jane, and family;Addams, Jane, health of",1916-05-12,1430 astor street chicago dear mari mari smith plan come cedarvil last week slight hemorrhag put bed begin sit feel good deal better rest hope next time noth interfer long defer visit marcet telegraph dorothi north last night come spend sunday chicago said mr michelson st luke hospit cours see much possibl write plan think doubt come last next week put end week quit sure shall littl setback plea give love dear invalid tell page 2 sorri postpon thing mani time cedarvil must charm impati see dear peopl live alway affection jane addam sign may 12 1916,"41.9085806,-87.6279494",Family;Health
2140,11878,"Jane Addams to Eleanor Daggett Karsten, March 20, 1916","Addams, Jane, travels",1916-03-20,hotel del coronado coronado beach california dear mr karsten plan back chicago sunday morn april 2 littl time write perhap mr thoma would interest enclos letter aw sorri use hastili jane addam march 20 1916,"32.6806331,-117.1785561",Travels
2142,11869,"Mabel L. Hyers to Jessie Pearl Everly, January 21, 1916",militarism;peace movement,1916-01-21,januari twentyfirst 1916 dear miss everli send separ cover literatur movement prepared countri also short report intern congress woman perman peac held hagu last april trust meet need sincer assist secretari miss jessi everli kingwood west virginia,"41.8781136,-87.6297982",Peace;Requests
2144,11863,"Jane Addams to Florence Kelley, January 21, 1916","Addams, Jane, requests from;peace movement, activities of;peace movement, international",1916-01-21,hullhous 800 south halst street chicago januari 21 1916 dear sister kelley somewhat disconcert letter say could becom one twenti deleg cours whole object committe five prepar meet time place term settlement made committe five expect attend matter cours would one twenti would one five realli feel could go second time would hardli worth go first put quit bluntli know dont doesnt mean quit crazi go spring meet spring larg prepar meet held later altogeth 35 deleg america origin five twenti elect ten altern reconsid situat page 2 telegraph dr jacob doctor consent april sail arriv twentieth least one committe chanc cours mr fanni fern andrew go time alway devotedli jane addam sign mr florenc kelley new york ny,"41.8716164,-87.6474573",Peace;Requests
2145,11860,"Jane Addams to Edith Abbott, January 21, 1916","Hull-House, educational programs;Addams, Jane, requests from",1916-01-21,hullhous 800 south halst street chicago januari 21 1916 dear miss abbott shall take someth report trade school new year book cut make littl special articl think would illumin use peopl would nice could also give littl someth relief work chang offic unit chariti etc may year book back finish two three hastili j,"41.8716164,-87.6474573",Hull-House
2146,11855,"Eleanor Dagget Karsten to Pauline Hatchitt, March 2, 1916","peace movement, activities of",1916-03-02,march 2nd 1916 dear mr hatchitt postal card address miss addam receiv offic miss addam away citi write say think best thing literatur sent miss white request keep hand distribut everi occas possibl sure club meet occas give dodger perhap good realiz peac exhibit panamapacif medal winner exposit coliseum first twelfth march distribut literatur dodger freeli possibl seem discourag sometim whole meet good success feel encourag hope abl use materi sincer offic secretari mr clay hatchitt presid woman peac parti frankfort kentucki,"41.8781136,-87.6297982",Peace
2147,11853,"Eleanor Dagget Karsent to Mary Johnson Claxton, March 2, 1916","peace movement, activities of;Addams, Jane, requests to",1916-03-02,march 2nd 1916 dear mr claxton letter februari 23rd address miss addam refer take great pleasur send mr j j van ness nashvil tennesse materi peac movement also write special phase situat interest glad furnish addit materi line sincer offic secretari mr p p claxton bureau educ washington dc,"41.8802312,-87.6245874",Peace;Requests
2148,11846,"Paul Underwood Kellogg to Emily Greene Balch, March 1916","Addams, Jane, and peace movement;peace movement, activities of",1916-03-01,miss balch miss addam sent col spring regret special pressur work held 12 day receiv said ford pilgrim ask forward read hope delay hasnt inconvenienc enough data write u statement present statu ford plan,"40.7127753,-74.0059728",Conferences;Peace;Requests
2149,11842,"Eleanor Daggett Karsten to Dorothea Hollins, February 11, 1916","peace movement;press, the;peace movement, activities of",1916-02-11,februari 11th 1916 dear miss hollin letter address miss addam forward offic miss addam absenc write say much interest plan internationalist daili labour paper miss addam away time take enforc rest therefor abl take matter mr ford hear plan leav long europ perhap would well take directli wish success undertak sincer offic secretari miss dorothea hollin 21 mulberri walk chelsea sw london england,"41.8781136,-87.6297982",Peace
2158,11781,"Harriet Park Thomas to Helen A. Davis, February 10, 1916","Addams, Jane, requests from;women's clubs",1916-02-10,februari 10th 1916 dear miss davi request miss addam write ask becom member cooper council see enclos folder presid mani larg nation woman organ act council woman peac parti organ last year tri get repres name ywca presid think ill arrang never complet hope much permit u use name new folder issu revis list nation offic sincer execut secretari miss helen davi 600 lexington avenu new york citi enc,"41.8781136,-87.6297982",Requests
2162,11765,"Eleanor Daggett Karsten to Frances Briley Enochs, February 16, 1916","peace movement, activities of",1916-02-16,februari 16th 1916 dear mr enoch letter februari 14th address mr thoma miss addam refer offic would suggest write mr fanni fern andrew american school peac leagu 405 marlborough street boston massachusett two articl mention sure would abl help connect furnish copi trojan woman price 75 wish u enclos list publish woman peac parti note sever peac pageant list perhap interest sincer offic secretari mr tom enoch fernwood pike counti mississippi enc,"41.8781136,-87.6297982",Peace
2168,11752,"Eleanor Daggett Karsten to Laura Hanes Cadwallader, March 18, 1916","Addams, Jane, and peace movement;peace movement, activities of;Addams, Jane, requests to",1916-03-18,march 18th 1916 dear miss cadwallad letter address miss addam refer offic send separ cover materi distribut regret bear directli question mind believ may find good deal point includ recent publish bibliographi dr mez peac literatur war may help also list public american peac societi world peac foundat would like call attent miss addam recent hear hous committe militari affair give well posit woman peac parti enclos letter copi constitut congression program hope may interest caus peac gener may will urg format univers wisconsin branch woman peac parti last week newli appoint presid univers chicago branch woman peac parti call offic talk plan work hope larg mass meet school peac day 18th may meet realli good one perfunctori observ day plea write u way help hope materi reach time assist sincer offic secretari miss laura cadwallad 416 n carrol st madison wisconsin,"41.8802312,-87.6245874",Peace;Requests
2169,11744,"Amelia Sears to Lillie Price Hounsell, March 17, 1916.","Addams, Jane, requests to;peace movement, activities of",1916-03-17,march 17th 1916 mr c e hounsel rd 2 hood river oregon dear mr hounsel regret exceedingli note miss addam remain unansw long miss addam turn promptli organ mislaid came across know presum miss addam ill winter enclos letter three copi miss addam hear committe militari affair also send letter woman peac parti request send literatur realiz literatur come late purpos origin want possibl put use apolog delay repli letter assur miss addam way blame remain truli superintend,"41.8781136,-87.6297982",Peace
2172,11739,"Jane Addams to Robert Lansing, January 14, 1916","Addams, Jane, requests from;peace movement, activities of",1916-01-14,1716 new hampshir avenu dear mr lan may ventur send enclos platform union democrat control also enclos articl norman angel one founder show type think new line thank courtesi faith jane addam seci state,"38.913234,-77.040462",Peace
2174,11716,"Jane Addams to Landonia Randolph Minor Dashiell, February 4, 1916","women's clubs;Addams, Jane, requests from",1916-02-04,februari fourth 1916 dear mr dashiel great regret accept resign state chairman virginia appreci fact busi local affair hesit take burden find howev everi commun busi woman continu new progress thing hope might abl suggest someon activ woman club work might will take posit chairman state exceedingli grate could send name sort thank done help u hope hear soon regard successor believ sincer mr l r dashiel 920 west grace street richmond va,"41.8781136,-87.6297982",Requests
2176,11681,"Eleanor Daggett Karsten to T. J. Park, February 15, 1916",apologies;peace,1916-02-15,februari 15th 1916 dear mr park letter februari 8th address miss addam absenc refer offic regret say woman peac parti fund command plan outlin letter wish success effort bring peac sincer offic secretari mr j park station l atkin hall washington dc,"41.8781136,-87.6297982",Finances;Peace
2179,11676,"Eleanor Daggett Karsten to Lucile Gulliver, February 15, 1916","women's clubs;peace movement, women and;peace movement, organization of",1916-02-15,februari 15th 1916 dear miss gulliv letter address miss addam refer offic absenc take pleasur send herewith five copi constitut woman peac parti adopt washington annual meet 1916 ten copi congression program adopt time find file letter woman auxiliari nation secur leagu miss elizabeth curtis nolan secretari treasur chicago branch 108 south lasal street sure letter address would give inform refer presid woman organ defens desir sincer offic secretari miss lucil gulliv hotel st jame 109113 west 45th street new york citi enc,"41.8781136,-87.6297982",Peace
2183,11653,"Mabel L. Hyers to Landonia Randolph Minor Dashiell, January 12, 1916","peace movement, activities of",1916-01-12,januari twelfth 1916 dear mr dashiel wish acknowledg note miss addam letter mr thoma absenc regret exceedingli feel necessari resign chairmanship virginia cours appreci fact busi call letter attent offic upon return take matter resign sincer assist secretari mr l r dashiel 920 west grace street richmond virginia,"41.8781136,-87.6297982",Peace
2185,11648,"Jane Addams to Lillian D. Wald, November 12, 1915","meetings;Addams, Jane, relationship with Lillian Wald",1915-11-12,1430 astor street chicago dear ladi proud author copi done littl el read ever sinc came aw good read want congratul heart meet woman peac parti mcalpin hotel new york 19 th 20 th month shall sure see page 2 perhap could henri st group talk neutral confer real develop late alway devotedli jane addam nov 12 1915,"41.9085826,-87.6279508",Meetings
2189,11610,"Mabel L. Hyers to Charles Orlando Frye, January 11, 1916","peace movement, activities of;Addams, Jane, requests to",1916-01-11,januari eleventh 1916 dear mr frye letter januari 6th miss jane addam thank favor miss addam citi present say peac parti futur becom clear hous miss addam suggest shall glad take proposit suggest make brief outlin plan say two three page send offic sincer assist secretari mr charl frye 5820 catharin street philadelphia pennsylvania,"41.8781136,-87.6297982",Peace;Requests
2190,11589,"Harriet Park Thomas to Florence G. Taussig, January 19, 1916","peace movement, activities of",1916-01-19,januari nineteenth 1916 dear mr taussig miss addam ask express great gratif abl serv execut committe woman peac parti constitut congression program adopt annual meet print washington ship u soon press note mr mead request quantiti sent hope receiv within day sincer mr frederick j taussig st loui missouri,"41.8781136,-87.6297982",Peace
2193,11573,"Secretary to Jane Addams to Casson Eugene Parsons, January 31, 1916","peace movement, activities of;Addams, Jane, requests to;World War I, peace negotiations",1916-01-31,januari thirtyfirst 1916 dear mr parson may repli miss addam letter januari 26th say present time emerg peac feder practic dead organ although ralli forc everi special thing last two time call upon promot idea resolut suggest confer neutral end telegram campaign made quit clear presid act upon question mr ford undertook privat commiss bring unoffici confer neutral thing establish sit stockholm mr lochner secretari emerg peac feder attend confer miss addam leav west tomorrow imposs feder act even upon excel resolut present trust heart offici confer neutral may brought sincer assist secretari mr c e parson american peac societi 840 cass st detroit michigan,"41.8781136,-87.6297982",Conferences;Peace;Requests
2197,11531,"Jane Addams to Mabel L. Hyers, January 17, 1916","Addams, Jane, requests from;peace movement, activities of",1916-01-17,hullhous 800 south halst street chicago januari 17 1916 dear miss hyer dont seem abl recal manuscript ladi write possibl sent woman peac parti written manuscript would use without consent plea see find file hastili jane addam sign miss mabel hyer chicago illinoi,"41.8716354,-87.6474381",Peace;Requests
2202,11502,"Jane Addams to Frank Buchman, May 1, 1912","Addams, Jane, gratitude",1912-05-01,hullhous 800 south halst street chicago may 1 1912 dear mr buchman mani thank box beauti trail arbutu came morn grate inde kindli thought boy sincer jane addam sign secretari frank buchman esq state colleg pennsylvania page 2 carl johnsonbaugh ray mingl fred orvi ewe john spangler georg fulton sylvest atkinson guy shuey montgomeri weaver roll call read minut address good club new busi new busi new busi written sideway middl column 75 15 375 75 1125 600 written upsid middl column 250 90 340 500 250 base ball 550 650 1950 written upsid left column atkinson 1 gal gilliliand 1 gal j snyder 1 gal f everi 1 gal f fulton 1 gal e resid 1 gal weaver 1 gal pay juli 5 1912 c johnsonbaugh 1 gal g fulton 1 gal g kline 1 gal,"40.7933949,-77.8600012",Thanks
2204,11494,"Jane Addams to George Middleton, March 2, 1915","Addams, Jane, travels;Addams, Jane, requests to",1915-03-02,hullhous 800 south halst street chicago march 2 1915 dear mr middleton almost point leav chicago fill seri speak engag east shall back chicago 15th month imposs avail kind invit hope much pleasur see next time chicago may one read hullhous much appreci courtesi sincer jane addam sign georg middleton esq chicago illinoi,"41.8716354,-87.6474381",Lectures;Requests;Travels
2207,11488,"Jane Addams to William Isaac Hull, January 27, 1916","Addams, Jane, travels;Addams, Jane, and peace movement;peace movement, activities of",1916-01-27,hullhous 800 south halst street chicago januari 27 1916 dear professor hull order california two month hope abl sail earli april meet intern committe woman meet durabl peac organ call bern month know littl actual work ford plan certainli could present urg anyth el combin letter mr bryan today express willing accept may go later requir stay long time thank kind letter hope see april faith jane addam sign professor w hull swarthmor pennsylvania,"41.8716354,-87.6474381",Peace;Travels
2210,11433,"Jane Addams to Hannah Tunnelle Bonsall. January 16, 1916","Addams, Jane, gratitude;peace movement, activities of",1916-01-16,hullhous 800 south halst street chicago januari 16 1916 dear mr bonsal may thank letter found await upon return washington afraid plan suggest feasibl alreadi discus europ abandon utterli impractic sincer appreci letter faith jane addam sign mr e h bonsal morton pennsylvania,"41.8716354,-87.6474381",Thanks
2211,11413,"Mabel L. Hyers to Aletta Baird Frizzell, November 10, 1915","peace movement, women and;women's clubs",1915-11-10,novemb 10 1915 dear mr frizzel send separ cover today literatur concern woman peac parti hope hear interest may pleasur serv futur sincer assist secretari mr r b frizzel monro louisiana,"41.8781136,-87.6297982",Peace
2216,11374,"Alice Hamilton to Harriet Park Thomas, December 14, 1915","Addams, Jane, requests from;peace movement, activities of;peace movement, international",1915-12-14,hullhous 800 south halst street chicago decemb 14th 1915 dear mr thoma miss addam ask give copi cabl send also enclos letter ladi barlow suggest write ask wait washington meet woman peac parti address ladi barlow haverford colleg haverford pa mail certainli forward sincer alic hamilton sign,"41.8716164,-87.6474573",Peace;Requests
2220,11350,"Harriet Park Thomas to Clara Jane Bryant Ford, December 9, 1915","Addams, Jane, health of;Addams, Jane, and peace movement;peace movement, activities of",1915-12-09,decemb ninth 1915 dear mr ford miss addam much touch gratifi yesterday receiv wireless oscar ii love respect miss expect sign member peac expedit list head name mr ford madam schwimmer today receiv second messag ask news condit ask write someth ask send wireless mr ford probabl frequent includ announc improv tell somewhat intim detail condit includ much think best messag send miss addam run slight temperatur daili doctor say characterist pu infect also tuberculosi constant appear pu urin diagnosi seem reduc either infect kidney tuberculosi kidney cours hope former clear although mean great drain vital doctor say symptom indic troubl go slowli give diagnosi exhaust test see miss addam everi day habitu cheer hope join peac expedit later cours make definit plan yet think would like tell messag still hope go later great pleasur meet new york hope furnitur collect gone satisfactorili felt time fortun delight interest move new home junction morn spoke chicago branch woman peac parti gave impress expedit describ leav boat mani ladi express gratif heard page 2 version unlik sensat report newspap enclos clip littl interview gave newspap upon return last sunday publish said glad see spirit gobbl miss addam ask send warm regard sincer execut secretari mr henri ford hotel biltmor new york citi,"41.8781136,-87.6297982",Health;Peace
2221,11349,"Mabel L. Hyers to Amelia Hickenlooper Dunham, December 9, 1915","peace movement, activities of",1915-12-09,decemb ninth 1915 dear mr dunham may repli kind note miss addam say thank express concern thanksgiv day telegram woman peac parti want unjust peac propos continu mediat mean simpli slaughter shall stop term peac shall well thought settlement brought enclos separ cover pamphlet explain quit fulli plan confer nation would follow sincer assist secretari mr kennon dunham 2503 auburn avenu mount auburn cincinnati ohio,"41.8781136,-87.6297982",Peace
2222,11336,"Jane Addams to Emily Greene Balch, November 29, 1915","peace movement, financial support for;Addams, Jane, and peace movement",1915-11-29,hullhous 800 south halst street chicago novemb 29 1915 dear miss balch would suggest send amount collect amsterdam directli charg dr jacob headquart mr pinchot made arrang send 300 long keep account sent america think necessari tell disappoint telegram came morn ventur telegraph seem fail alway faith jane addam sign miss emili balch wellesley massachusett,"41.8716354,-87.6474381",Finances;Peace
2223,11334,"Mabel L. Hyers to Eliza Vincent, January 6, 1916","Addams, Jane, requests to;Addams, Jane, health of;peace movement, activities of",1916-01-06,januari sixth 1916 dear mr vincent letter novemb 24th enclosur sent offic delay time say judg hullhous miss addam ill opportun use intend pas sure find contribut place peac movement return sorri delay long sincer assist secretari mr eliza vincent 606 west main st urbana illinoi enc,"41.8781136,-87.6297982",Peace;Requests
2224,11331,"Mabel L. Hyers to Margarita Abraham Stewart, January 6, 1916","Addams, Jane, gratitude",1916-01-06,januari sixth 1916 dear miss stewart thank miss addam thought new year greet appreci work sincer assist secretari miss margarita stewart 138 oxford st brooklyn ny,"41.8781136,-87.6297982",Thanks
2225,11324,"Secretary to Jane Addams to Grace DeGraff, March 31, 1915","Addams, Jane, requests from;Addams, Jane, travels",1915-03-31,march 31 1915 dear miss degraff miss addam make final list go hagu yet heard whether possibl go let u know soon possibl decis hope cordial succeed make arrang sincer assist secretari miss grace degraff 490 magnolia street portland oregon,"41.8716354,-87.6474381",Requests;Travels
2226,11323,"Secretary to Jane Addams to M. Belle Brown, March 31, 1915","Addams, Jane, gratitude",1915-03-31,march 31 1915 dear dr brown letter miss addam refer answer came greatli absorb sister ill termin fatal taken correspond accumul time ask thank kind offer seasick remedi say never use anyth kind would happi accept packag care send possibl may valu member parti go hagu enclos call congress may interest suppos know miss addam presid sincer bell brown md troy miami counti ohio,"41.8716354,-87.6474381",Family;Health;Travels
2228,11321,"Secretary to Jane Addams to James Dana Bell, March 31, 1915","peace movement, activities of;Addams, Jane, and family",1915-03-31,march 31 1915 mr j bell central nation bank bldg st petersburg florida dear sir letter came miss addam east return greatli absorb ill death sister take correspond accumul interv request say far know leagu limit armament organ one join constitut execut committe public depart suggest alreadi member american peac societi join bodi directli address colorado build washington dc membership societi entitl receiv advoc peac publish monthli sincer,"41.8716354,-87.6474381",Peace;Requests
2230,11311,"Harriet Park Thomas to William Hope Harvey, January 5, 1916","Addams, Jane, gratitude;Addams, Jane, health of",1916-01-05,januari fifth 1916 dear mr harvey probabl know paper miss addam taken ill ford expedit start unabl member parti hospit time sinc still unabl give attent correspond ask thank book sent entitl remedi let hear regard abl read sincer mr william h harvey 222 midland build kansa citi missouri,"41.8781136,-87.6297982",Thanks
2231,11309,"Jane Addams to Mary Zimmerman, January 5, 1916","Addams, Jane, gratitude",1916-01-05,hullhous 800 south halst street chicago dear miss zimmerman may thank charm plant sent new year day one love thing alway devotedli jane addam jani 5 1916,"41.8716164,-87.6474573",Thanks
2234,11283,"Harriet Park Thomas to Alice Thacher Post, December 30, 1915","peace movement, activities of;Addams, Jane, requests from",1915-12-30,decemb thirtieth 1915 dear mr post miss addam think second notic annual meet go offic close new year holiday consequ send proof printer today without wait news washington notic mere remind go postal card realli room includ detail inform hour sunday afternoon meet never mention assum halfpast three oclock announc postal card howev matter insignific find earlier hour arrang announc made saturday even session also sunday morn paper miss addam hope make arrang work fall upon done comfort fashion possibl also ask request engag engag offici stenograph session convent soon miss breckinridg return ask send check 10000 upon may draw expens wish pay cash today receiv letter mr catt express regret abl attend annual meet suffrag board session new york date mr ruble left chicago insist miss addam guest convent persuad miss addam quiet seclud privat home hotel definit settl miss addam much inclin toward mr ruble invit wish washington help way seem work convent carri end line miss addam shall probabl arriv two day open convent hope work readi get sincer execut secretari mr loui f post 2513 twelfth street washington dc,"41.8781136,-87.6297982",Meetings;Peace;Requests
2235,11282,"Mabel L. Hyers to Lucy Biddle Lewis, November 8, 1915","conferences;peace movement, women and",1915-11-08,novemb 8 1915 dear mr lewi enclos request miss addam copi resolut hagu congress back find explan intern committe woman perman peac concern mysteri commun receiv sincer assist secretari mr luci biddl lewi lansdown pennsylvania,"41.8781136,-87.6297982",Conferences;Peace
